{
  "schema_version": "v1.0",
  "service_name": "TimeSeriesService",
  "request_id": null,
  "mode": "time",
  "window_type": "current",
  "slider_value": 0,
  "line_scope": "all",
  "requested_metrics": [
    "availability_pct",
    "clog_rate_pct",
    "pressure_bar",
    "flow_rate_ml_min",
    "maintainability_pct",
    "quality_score_pct",
    "risk_text",
    "spray_width_mm",
    "recipe_name",
    "temperature_c",
    "utilization_pct",
    "cycle_time_sec"
  ]
}
